Category,Text
general-office-assistant,"Contact [email protected] +1 (555) 987-6543 Skills • Calendar Management • Travel Coordination • Event Planning • Communication Skills • Microsoft Office Suite • Project Management Michael Johnson New York, NY | himalayas.app/@michaeljohnson Detail-oriented Executive Assistant with over 6 years of experience in supporting C-level executives in fast-paced corporate environments. Proven ability to manage multiple priorities, streamline processes, and enhance operational efficiency to drive organizational success. Professional Experience GlobalTech Innovations New York, NY Executive Assistant Mar 2021 - Present Supported the CEO and CFO by managing schedules, coordinating meetings, and handling travel arrangements for over 50 business trips annually. Developed an efficient filing system that reduced document retrieval time by 30%. Organized quarterly executive meetings, including logistics and agenda preparation, resulting in enhanced communication and decision-making. Innovate Enterprises San Francisco, CA Administrative Assistant Jan 2018 - Feb 2021 Managed scheduling and administrative tasks for a team of 10 executives, improving time management and operational workflows. Assisted in organizing company events and employee engagement activities, increasing team morale and collaboration. Implemented a new digital calendar system that enhanced scheduling efficiency by 25%. Education University of California, Berkeley Berkeley, CA B.A. Business Administration 2014 - 2018 Concentration in organizational management and communications. Completed coursework in project management and business operations."
general-pediatrician,"Contact [email protected] +61 2 1234 5678 Skills • Pediatric Medicine • Healthcare Leadership • Telemedicine • Clinical Research • Patient Advocacy Dr. Emily Carter Sydney, NSW | himalayas.app/@dr.emilycarter Dedicated and experienced Chief of Pediatrics with over 15 years of expertise in pediatric medicine and healthcare leadership. Proven track record in improving patient care standards, leading multidisciplinary teams, and implementing innovative healthcare programs to enhance pediatric services. Professional Experience Sydney Children's Hospital Sydney, NSW Chief of Pediatrics Jan 2020 - Present Implemented a new pediatric care model that improved patient satisfaction scores by 30% within the first year Led a team of 50+ medical professionals, fostering a collaborative environment that reduced staff turnover by 20% Developed and launched a pediatric telemedicine program, increasing access to care for remote communities by 40% Royal Children's Hospital Melbourne, VIC Pediatrician Jan 2015 - Dec 2019 Managed complex pediatric cases, achieving a 95% patient recovery rate through innovative treatment plans Conducted research on pediatric asthma, leading to a published paper in a renowned medical journal Participated in community outreach programs, educating families on childhood health issues Children's Hospital at Westmead Sydney, NSW Senior Pediatric Consultant Jan 2010 - Dec 2014 Developed treatment protocols that reduced hospital readmission rates by 25% Mentored junior doctors and medical students, enhancing their clinical skills and knowledge Collaborated with multidisciplinary teams on pediatric research projects, resulting in improved clinical outcomes Education University of Sydney Sydney, NSW M.D. in Pediatrics 2005 - 2009 Focused on pediatric health and clinical practice, with honors in research projects related to childhood diseases. University of New South Wales Sydney, NSW Master of Health Administration 2012 - 2014 Specialized in healthcare leadership and management, emphasizing quality improvement in pediatric care."
general-pediatrician,"Contact [email protected] +33 1 23 45 67 89 Skills • Pediatric Care • Child Development • Patient Management • Community Health • Emergency Medicine Marie Dupont Paris, France | himalayas.app/@mariedupont Compassionate and experienced Lead Pediatrician with over 10 years of dedicated service in child healthcare. Proven track record in leading medical teams, managing pediatric care, and enhancing health outcomes for children through innovative treatment plans and community outreach programs. Professional Experience Pediatric Health Center Paris, France Lead Pediatrician Mar 2020 - Present Oversaw a team of 12 pediatricians and healthcare professionals, improving patient satisfaction ratings by 30% within two years. Developed and implemented new pediatric care protocols that reduced hospital readmission rates by 25%. Conducted community health workshops, educating over 500 families on preventative care and healthy practices. Children's Medical Institute Lyon, France Pediatrician Jan 2015 - Feb 2020 Managed a diverse caseload of pediatric patients, providing comprehensive care and follow-up. Collaborated with specialists to address complex health issues, resulting in improved treatment outcomes. Led initiatives to promote vaccinations, achieving a 95% immunization rate in the local community. Education University of Paris Paris, France M.D. in Pediatrics 2008 - 2015 Completed comprehensive training in pediatric medicine, with a focus on child development and health promotion."
general-pediatrician,"Contact [email protected] +44 20 7946 0958 Skills • Pediatric Care • Child Development • Patient Education • Clinical Research • Multidisciplinary Collaboration James Anderson London, UK | himalayas.app/@jamesanderson Compassionate and dedicated Senior Pediatrician with over 10 years of experience in providing exceptional medical care to children. Proficient in diagnosing and treating a wide range of pediatric conditions while ensuring a supportive environment for both patients and families. Professional Experience Great Ormond Street Hospital London, UK Senior Pediatrician Mar 2018 - Present Managed a diverse caseload of pediatric patients with complex health issues, achieving a 95% patient satisfaction score. Implemented new treatment protocols that reduced hospital readmission rates by 30%. Led a multidisciplinary team in the development of a child obesity prevention program, resulting in a 40% increase in patient participation. Royal Manchester Children's Hospital Manchester, UK Pediatrician Jul 2015 - Feb 2018 Conducted comprehensive assessments and provided treatments for children with chronic illnesses, improving long-term health outcomes. Collaborated with specialists to establish individualized care plans for patients, enhancing overall patient care. Participated in community outreach programs to educate parents on child health and nutrition. Education University of Edinburgh Edinburgh, UK M.D. Pediatric Medicine 2008 - 2014 Completed extensive training in pediatric medicine with a focus on child development and family-centered care."
general-service-technician,"Contact [email protected] +27 21 123 4567 Skills • Mechanical Repair • Preventive Maintenance • Troubleshooting • Equipment Installation • Team Leadership Liam van der Merwe Johannesburg, South Africa | himalayas.app/@liamvandermerwe Highly skilled Senior Service Technician with over 10 years of experience in servicing and maintaining industrial equipment. Proven track record in diagnosing complex mechanical issues and implementing effective solutions to enhance operational efficiency and minimize downtime. Professional Experience SAB Miller Johannesburg, South Africa Senior Service Technician Mar 2019 - Present Led a team of 5 technicians in the maintenance of brewing equipment, resulting in a 30% reduction in equipment failure rates. Implemented a predictive maintenance program that increased machinery uptime by 25% over 12 months. Conducted training sessions for junior technicians on best practices for equipment servicing and safety protocols. BrewTech Solutions Cape Town, South Africa Service Technician Jan 2015 - Feb 2019 Performed regular maintenance and emergency repairs on a variety of brewing systems, achieving a 98% customer satisfaction rate. Assisted in the installation of new brewing equipment, ensuring compliance with safety and operational standards. Developed troubleshooting guides that improved response time to service calls by 40%. Education Cape Town Technical College Cape Town, South Africa Diploma in Mechanical Engineering 2012 - 2014 Focused on mechanical systems design and maintenance. Included practical training in industrial equipment operations."
general-service-technician,"Contact [email protected] +61 2 1234 5678 Skills • Technical Troubleshooting • Customer Service • Electronics Repair • Communication • Time Management Emily Johnson Sydney, NSW | himalayas.app/@emilyjohnson Enthusiastic and detail-oriented Entry-Level Service Technician with a strong foundation in technical support and customer service. Passionate about solving problems and providing exceptional service to clients. Eager to leverage skills in a dynamic environment to contribute to team success. Professional Experience TechRepair Australia Sydney, NSW Service Technician Intern Jan 2023 - Jun 2023 Assisted senior technicians in diagnosing and repairing consumer electronics, improving repair efficiency by 20% Provided excellent customer service by communicating clearly and effectively with clients regarding their device issues Maintained accurate records of repairs and customer interactions, enhancing data accuracy by 30% QuickFix Electronics Sydney, NSW Customer Service Associate Jun 2022 - Dec 2022 Handled customer inquiries and complaints, achieving a 95% satisfaction rating during tenure Resolved technical issues over the phone, providing step-by-step assistance to customers Collaborated with team members to streamline service processes, reducing average response time by 15% Education TAFE NSW Sydney, NSW Certificate III in Electronics and Communications 2021 - 2022 Gained hands-on experience in electronics repair, customer service, and technical troubleshooting."
general-superintendent,"Contact [email protected] +52 55 1234 5678 Skills • Project Management • Construction Safety • Budget Management • Team Leadership • Regulatory Compliance José Martínez Mexico City, Mexico | himalayas.app/@josemartinez Dedicated Regional Superintendent with over 10 years of experience in managing large-scale construction projects. Proven track record of delivering projects on time and within budget while ensuring the highest safety and quality standards. Skilled in team leadership, contractor management, and regulatory compliance. Professional Experience Constructo Group Mexico City, Mexico Regional Superintendent May 2020 - Present Managed the construction of multiple commercial and residential projects with budgets exceeding $10M. Implemented safety protocols that reduced workplace accidents by 30% over two years. Coordinated with architects and engineers to ensure project specifications were met, resulting in a 95% client satisfaction rate. Edifica S.A. Guadalajara, Mexico Construction Manager Mar 2016 - Apr 2020 Oversaw the construction of residential developments, managing teams of up to 50 workers. Successfully reduced material costs by 15% through strategic sourcing and vendor negotiations. Developed and maintained project schedules, ensuring timely completion of all phases. Inova Builders Monterrey, Mexico Site Supervisor Jan 2014 - Feb 2016 Supervised daily operations on construction sites, ensuring compliance with safety regulations. Trained and mentored junior staff, fostering a culture of safety and quality. Conducted regular site inspections to ensure adherence to project specifications. Education Universidad Nacional Autónoma de México Mexico City, Mexico B.S. Civil Engineering 2009 - 2014 Specialized in construction management and structural engineering. Participated in various student-led construction projects."
general-superintendent,"Contact [email protected] +39 02 1234 5678 Skills • Project Management • Construction Safety • Budget Management • Team Leadership • Quality Control Giulia Rossi Milan, Italy | himalayas.app/@giuliarossi Dedicated General Superintendent with over 10 years of experience in the construction industry, specializing in project management and team leadership. Proven track record of successfully managing complex projects from conception to completion while maintaining high standards of safety and quality. Professional Experience ConstructIt Milan, Italy General Superintendent Mar 2019 - Present Oversaw construction of multi-million euro commercial projects, ensuring timely delivery within budget constraints. Implemented safety protocols that reduced workplace accidents by 30% over three years. Coordinated with subcontractors and suppliers to optimize workflow and material delivery, enhancing project efficiency by 25%. BuildRight Rome, Italy Project Manager May 2015 - Feb 2019 Managed residential construction projects with budgets exceeding €5 million, achieving a 95% client satisfaction rating. Developed project schedules and budgets, closely monitoring progress and resource allocation. Led a team of engineers and contractors, fostering effective communication and collaboration. GreenBuild Florence, Italy Site Supervisor Jan 2013 - Apr 2015 Supervised day-to-day operations on construction sites, ensuring adherence to safety and quality standards. Conducted regular inspections and audits, leading to a 20% improvement in compliance rates. Trained new employees on safety regulations and best construction practices. Education Politecnico di Milano Milan, Italy B.Sc. in Civil Engineering 2009 - 2013 Focused on structural engineering and project management. Completed a thesis on sustainable building practices."
general-superintendent,"Contact [email protected] +1 (555) 987-6543 Skills • Educational Leadership • Curriculum Development • Staff Development • Student Engagement • Data Analysis • Community Outreach Emily Johnson Lincoln, NE | himalayas.app/@emilyjohnson Dedicated Assistant Superintendent with over 10 years of experience in educational administration and leadership. Proven track record of enhancing academic programs and fostering a positive learning environment while effectively managing school operations and staff. Professional Experience Lincoln School District Lincoln, NE Assistant Superintendent Aug 2020 - Present Implemented a district-wide curriculum revision that improved student performance by 15% over two academic years. Led professional development workshops for over 200 educators, enhancing teaching strategies and classroom management skills. Collaborated with community stakeholders to increase student enrollment by 20% through targeted outreach and engagement initiatives. Greenwood High School Greenwood, NE Principal Jul 2015 - Jul 2020 Enhanced school performance ratings from ‘C’ to ‘A’ by implementing innovative teaching methods and rigorous academic standards. Increased graduation rates from 85% to 95% through personalized student support programs. Championed the integration of technology in the classroom, resulting in a 30% increase in student engagement. Maplewood School District Maplewood, NE Assistant Principal Aug 2012 - Jun 2015 Assisted in developing the school’s strategic plan, contributing to a 25% increase in teacher retention rates. Coordinated special education programs, ensuring compliance with state and federal regulations. Facilitated parent-teacher conferences to strengthen community relationships and support student success. Education University of Nebraska Lincoln, NE Ed.D. Educational Leadership 2015 - 2019 Focused on school leadership, educational policy, and curriculum development. Dissertation on the impact of leadership styles on school performance. University of Nebraska Lincoln, NE M.A. Education 2010 - 2012 Specialized in curriculum and instruction with a focus on improving student outcomes."
general-surgeon,"Contact [email protected] +1 (555) 987-6543 Skills • Surgical Leadership • Patient Safety • Minimally Invasive Surgery • Clinical Research • Mentoring Dr. Emily Johnson Los Angeles, CA | himalayas.app/@emilyjohnson Accomplished Chief of Surgery with over 15 years of experience in leading surgical teams and enhancing surgical procedures. Adept at implementing best practices that improve surgical outcomes and patient safety, with a strong track record of mentoring surgeons and fostering a collaborative medical environment. Professional Experience St. Mary’s Medical Center Los Angeles, CA Chief of Surgery Mar 2019 - Present Directed a team of 50+ surgeons, achieving a 30% reduction in surgical complications over 3 years. Implemented advanced surgical techniques that increased patient satisfaction scores by 25%. Led initiatives to enhance surgical training programs, resulting in a 40% increase in resident participation. City Hospital San Francisco, CA Surgeon Jun 2012 - Feb 2019 Performed over 1,500 complex surgeries with an outstanding success rate. Collaborated with multidisciplinary teams to develop protocols for patient safety that reduced readmission rates by 15%. Engaged in clinical research, contributing to advancements in minimally invasive surgical techniques. Education Stanford University School of Medicine Stanford, CA M.D. in Medicine 2005 - 2009 Graduated with honors, focusing on surgical methodologies and patient care. University of California, Berkeley Berkeley, CA B.S. in Biology 2001 - 2005 Emphasized on human anatomy and physiology, graduating with a GPA of 3.9."
general-surgeon,"Contact [email protected] +65 9123 4567 Skills • Minimally Invasive Surgery • Patient Care • Surgical Research • Team Leadership • Clinical Decision Making Dr. Emma Tan Singapore | himalayas.app/@emmatan Dedicated and skilled Consultant General Surgeon with over 10 years of experience in performing complex surgical procedures and providing exceptional patient care. Proven track record in enhancing surgical outcomes through innovative techniques and a patient-centric approach. Professional Experience Singapore General Hospital Singapore Consultant General Surgeon Mar 2020 - Present Performed over 500 successful laparoscopic surgeries with a complication rate below 2% Implemented enhanced recovery protocols, reducing hospital stay by an average of 30% Mentored 10+ surgical residents, fostering skills in both surgical techniques and patient management Mount Elizabeth Hospital Singapore General Surgeon Jan 2015 - Feb 2020 Specialized in gastrointestinal and endocrine surgeries, achieving a 95% patient satisfaction score Conducted research on minimally invasive techniques, leading to presentations at international conferences Collaborated with multidisciplinary teams to optimize patient care and postoperative recovery protocols Education National University of Singapore Singapore M.B.B.S. 2008 - 2012 Completed medical degree with a focus on surgical sciences and clinical practice. Royal College of Surgeons Edinburgh, Scotland Fellowship in General Surgery 2013 - 2015 Advanced training in general surgery with a focus on minimally invasive techniques."
general-surgeon,"Contact [email protected] +55 11 98765-4321 Skills • Surgical Techniques • Minimally Invasive Surgery • Patient Care • Laparoscopy • Trauma Surgery • Team Leadership Carlos Silva São Paulo, SP | himalayas.app/@carlossilva Dedicated General Surgeon with over 10 years of experience in performing complex surgical procedures. Proficient in utilizing advanced minimally invasive techniques to enhance patient recovery and outcomes. Committed to providing high-quality patient care and leading surgical teams to achieve excellence. Professional Experience Hospital das Clínicas São Paulo, SP General Surgeon May 2018 - Present Performed over 1,500 surgical procedures with a complication rate of less than 2%. Implemented new laparoscopic techniques that reduced patient recovery time by 30%. Mentored 10 residents in surgical techniques and patient management. Hospital São Paulo São Paulo, SP Surgical Resident Jun 2013 - Apr 2018 Assisted in over 1,000 surgical procedures across various specialties, including trauma and elective surgeries. Conducted pre-operative assessments and post-operative care for diverse patient populations. Contributed to a research project on post-surgical infection rates, leading to a 15% reduction in infections. Education Universidade de São Paulo São Paulo, SP M.D. Medicine 2007 - 2012 Completed medical degree with a focus on surgical practices and patient care."
general-worker,"Contact [email protected] +52 55 1234 5678 Skills • Team Leadership • Operational Management • Quality Control • Process Optimization • Training & Development Ana Maria Lopez Mexico City, Mexico | himalayas.app/@anamarialopez Dedicated General Work Supervisor with over 6 years of experience in operational management and team leadership in the manufacturing sector. Proven track record in enhancing productivity and ensuring adherence to quality standards while fostering a positive work environment. Professional Experience Grupo Bimbo Mexico City, Mexico General Work Supervisor Mar 2021 - Present Managed a team of 30+ employees, improving productivity by 25% through effective training and motivation strategies. Implemented quality control measures that reduced product defects by 15%. Coordinated daily operations and optimized workflows, resulting in a 20% decrease in downtime. Alsea Guadalajara, Mexico Operations Coordinator Jun 2018 - Feb 2021 Oversaw daily operations in a high-volume food service environment, serving over 500 customers daily. Trained and supervised a team of 15 staff members, resulting in a 30% increase in customer satisfaction scores. Developed and implemented operational procedures that enhanced service efficiency by 40%. Education Universidad de Guadalajara Guadalajara, Mexico Bachelor's Degree in Business Administration 2013 - 2017 Focused on management and operational strategies, graduating with honors."
general-worker,"Contact [email protected] +33 6 12 34 56 78 Skills • Project Management • Agile Methodologies • Team Leadership • Communication • Strategic Planning • Performance Improvement Julien Leclerc Paris, France | himalayas.app/@julienleclerc Dynamic and results-oriented Team Lead with over 7 years of experience in managing cross-functional teams in fast-paced environments. Proven track record in driving project success and enhancing team performance through effective leadership and strategic planning. Professional Experience Innovatech Solutions Paris, France Team Lead May 2021 - Present Led a team of 10 professionals to deliver high-impact projects, resulting in a 30% increase in client satisfaction. Implemented agile methodologies, reducing project delivery time by 25%. Conducted regular team performance reviews, fostering a culture of continuous improvement and accountability. TechVision Lyon, France Project Manager Mar 2018 - Apr 2021 Managed multiple projects simultaneously, ensuring alignment with organizational goals and timely delivery. Collaborated with stakeholders to define project scope and objectives, achieving a 95% on-time delivery rate. Mentored junior project managers, enhancing overall team competency and efficiency. Global Enterprises Marseille, France Team Coordinator Jan 2016 - Feb 2018 Coordinated day-to-day team activities and communication, improving team collaboration by 40%. Assisted in budget management and resource allocation, optimizing project costs by 15%. Organized training sessions that increased team skills and proficiency in project tools. Education ESSEC Business School Cesson, France M.S. in Management 2014 - 2016 Specialized in project management and organizational behavior. Participated in various leadership workshops and projects."
general-worker,"Contact [email protected] +44 20 7946 0958 Skills • Plumbing • Electrical Systems • Maintenance • Health and Safety Regulations • Project Management James Smith London, UK | himalayas.app/@jamessmith Dedicated and skilled worker with over 6 years of experience in the construction industry, specializing in plumbing and electrical installations. Proven track record of completing projects efficiently while adhering to safety regulations and quality standards. Professional Experience BuildRight Construction London, UK Skilled Worker Mar 2021 - Present Executed plumbing installations in residential and commercial properties, ensuring compliance with local building codes. Performed electrical wiring and maintenance tasks, achieving a 30% reduction in project delays through effective problem-solving. Collaborated with project managers to develop work schedules, enhancing team productivity by 25%. HomeFix Solutions Birmingham, UK Maintenance Technician Jan 2018 - Feb 2021 Conducted regular maintenance checks on plumbing and electrical systems to ensure optimal performance. Resolved urgent repair requests, consistently achieving a customer satisfaction rate of over 95%. Trained new technicians on safety protocols and maintenance procedures, improving team efficiency. Education City of Westminster College London, UK NVQ Level 3 in Plumbing and Heating 2015 - 2017 Comprehensive training in plumbing systems, heating, and water regulations, including practical hands-on experience."
