Category,Text
ged-instructor,"Contact [email protected] +44 20 7946 0958 Skills • Adult Education • Curriculum Development • Student Assessment • Classroom Management • Communication • Empathy Emily Johnson London, UK | himalayas.app/@emilyjohnson Compassionate and dedicated GED Instructor with over 5 years of experience in adult education. Proven track record of empowering students to improve their literacy and numeracy skills, achieving a 90% pass rate in GED examinations. Committed to fostering a supportive learning environment that encourages personal and academic growth. Professional Experience Bright Futures Academy London, UK GED Instructor Jan 2020 - Present Designed and delivered tailored lesson plans to meet the diverse needs of adult learners. Achieved a 90% pass rate among students in GED tests through targeted instruction and assessment. Implemented innovative teaching methods, including blended learning and interactive workshops. Learning Hub UK Birmingham, UK Adult Education Tutor Jun 2018 - Dec 2019 Facilitated classes for adult learners focusing on basic literacy and numeracy. Developed engaging materials and resources that improved student participation by 30%. Assisted students in preparing for various qualifications, leading to significant improvements in their confidence and skills. Education University of Birmingham Birmingham, UK PGCE in Adult Education 2016 - 2017 Postgraduate Certificate in Education with a focus on teaching adults. Included practical teaching placements and assessment strategies."
gis-geographer,"Contact [email protected] +52 1 55 1234 5678 Skills • ArcGIS • QGIS • Spatial Analysis • Cartography • Remote Sensing • Data Visualization Luis Martinez Mexico City, Mexico | himalayas.app/@luismartinez Detail-oriented GIS Specialist with over 5 years of experience in spatial data management and geographic analysis. Proven track record of delivering high-quality maps and spatial data products that support decision-making in urban planning and environmental management. Professional Experience GeoTech Solutions Mexico City, Mexico GIS Specialist Mar 2021 - Present Developed and maintained GIS databases for urban planning projects, improving data accessibility by 50% Created over 100 high-quality maps for various municipal departments, enhancing visual communication of spatial data Collaborated with cross-functional teams to integrate GIS technology into environmental assessments MapVision Inc. Guadalajara, Mexico GIS Analyst Jan 2018 - Feb 2021 Conducted spatial analysis for land use planning, leading to a 30% increase in project efficiency Utilized ArcGIS and QGIS to manage and analyze geospatial data, enhancing project accuracy and reliability Provided training to staff on GIS software and data interpretation, improving team capabilities Education University of Guadalajara Guadalajara, Mexico B.S. Geography 2013 - 2017 Focused on GIS technology and spatial analysis. Completed a thesis on urban heat islands using remote sensing data."
gis-mapping-technician,"Contact [email protected] +44 20 7946 0958 Skills • ArcGIS • QGIS • Spatial Analysis • Data Visualization • Cartography • Geographic Data Management Emily Thompson London, UK | himalayas.app/@emilythompson Detail-oriented Junior GIS Mapping Technician with 2+ years of experience in geographic information systems and spatial data analysis. Proven ability to create detailed maps and analyze spatial data to support urban planning and environmental assessments. Professional Experience GeoTech Solutions London, UK Junior GIS Mapping Technician Mar 2022 - Present Assisted in the development of GIS maps for urban development projects, enhancing project visualization by 30% Conducted spatial analysis to support environmental impact assessments, contributing to 5 successful project bids Collaborated with cross-functional teams to integrate GIS data into planning processes, improving data accessibility City Planning Agency Manchester, UK GIS Intern Jun 2021 - Feb 2022 Created and maintained GIS databases for city planning initiatives, ensuring data accuracy and integrity Produced detailed maps using ArcGIS for community development proposals, increasing stakeholder engagement Assisted in the analysis of spatial data to identify trends related to urban growth Education University of Manchester Manchester, UK B.Sc. Geography 2018 - 2021 Focused on GIS technology and spatial analysis. Completed key projects on land use mapping and environmental monitoring."
gis-professor,"Contact [email protected] +91 98765 43210 Skills • Geographic Information Systems • Spatial Analysis • Remote Sensing • Environmental Modeling • Data Visualization Dr. Rajesh Kumar New Delhi, India | himalayas.app/@rajeshkumar Accomplished academic leader with over 20 years of experience in Geographic Information Systems, spatial data analysis, and environmental science. Proven track record of innovative research, high-impact publications, and successful collaboration with governmental and non-governmental organizations. Professional Experience Indian Institute of Technology, Delhi New Delhi, India Distinguished Professor of GIS Aug 2015 - Present Conducted groundbreaking research on spatial modeling for urban planning, resulting in over 50 peer-reviewed publications. Established interdisciplinary collaborations with local governments to implement GIS solutions in urban management. Mentored PhD students and developed innovative coursework in GIS technologies and applications. National Remote Sensing Centre Hyderabad, India Senior Research Scientist Jan 2010 - Jul 2015 Led a team in developing remote sensing applications for disaster management and environmental monitoring. Designed and implemented a national GIS database for tracking land use changes across India. Presented findings at international conferences and contributed to policy-making discussions on environmental sustainability. Education Jawaharlal Nehru University New Delhi, India Ph.D. in Geography 2000 - 2005 Focused on spatial analysis and its applications in environmental science. Thesis on utilizing GIS for analyzing land use changes in urban areas."
gp-doctor,"Contact [email protected] +81 (90) 1234-5678 Skills • Patient Management • Chronic Disease Management • Healthcare Compliance • Clinical Research • Communication Skills • Electronic Health Records Yuki Tanaka Tokyo, Japan | himalayas.app/@yukitanaka Compassionate and dedicated Consultant GP with over 10 years of experience in general practice, skilled in diagnosing and managing a wide range of medical conditions. Proven track record in enhancing patient care and operational efficiency in healthcare settings. Professional Experience MediCare Solutions Tokyo, Japan Consultant GP Apr 2019 - Present Provided comprehensive primary care for a patient base of over 2,000 individuals, improving patient satisfaction scores by 30%. Implemented new electronic health record system, reducing patient wait times by 25%. Led health education workshops, increasing community awareness of chronic disease management. HealthFirst Clinic Osaka, Japan General Practitioner Jan 2015 - Mar 2019 Managed diverse patient cases with a focus on preventive medicine, achieving a 20% reduction in hospital admissions. Collaborated with specialists to provide integrated care plans for patients with complex health needs. Conducted research on patient outcomes, presenting findings at national healthcare conferences. Education Kyoto University Kyoto, Japan M.D. Medicine 2008 - 2014 Completed a rigorous program in medicine with a focus on general practice and primary care. Graduated with honors."
gp-doctor,"Contact [email protected] +44 20 7946 0958 Skills • Patient Care • Healthcare Management • Chronic Disease Management • Team Leadership • Public Health Education • Clinical Assessment • Preventive Care James Thompson London, UK | himalayas.app/@jamesthompson Compassionate and dedicated Lead GP Doctor with over 10 years of experience in providing exceptional patient care and leading healthcare teams. Proficient in managing chronic diseases and implementing preventive health strategies. Committed to enhancing patient outcomes and fostering a collaborative work environment. Professional Experience HealthFirst Medical Group London, UK Lead GP Doctor Jan 2020 - Present Oversaw a team of 15 general practitioners, improving patient satisfaction scores by 30% over two years. Implemented a new patient management system that reduced appointment wait times by 25%. Developed and led health education programs that increased community engagement in preventive health screenings by 40%. City Health Clinic Manchester, UK General Practitioner Jun 2015 - Dec 2019 Provided comprehensive medical care to a diverse patient population, achieving a 95% patient retention rate. Collaborated with specialists to coordinate care for patients with complex health issues, improving treatment outcomes. Conducted regular health assessments and developed personalized care plans, resulting in a significant decrease in hospital admissions. Education University of Edinburgh Edinburgh, Scotland M.B.B.S. 2006 - 2012 Completed rigorous training in general medicine, with a focus on primary care and public health."
gp-doctor,"Contact [email protected] +34 612 345 678 Skills • Patient Care • Chronic Disease Management • Health Education • Multidisciplinary Collaboration • Clinical Assessments Maria Gonzalez Madrid, Spain | himalayas.app/@mariagonzalez Compassionate and dedicated Senior GP Doctor with over 10 years of experience in primary care. Proven track record of improving patient outcomes through thorough assessments, personalized treatment plans, and collaborative care. Committed to enhancing the health and well-being of diverse patient populations. Professional Experience Hospital Universitario La Paz Madrid, Spain Senior GP Doctor Mar 2019 - Present Managed a patient case load of over 150 patients weekly, providing holistic care and chronic disease management. Implemented a new patient follow-up system that increased patient adherence to treatment plans by 30%. Collaborated with multidisciplinary teams to enhance service delivery and patient education programs. Centro de Salud Vallehermoso Madrid, Spain General Practitioner Jan 2015 - Feb 2019 Provided primary care services to a diverse community, including preventive health screenings and immunizations. Conducted comprehensive assessments leading to a 15% reduction in unnecessary referrals to specialists. Trained and mentored junior doctors and medical students in clinical practices and patient care. Education Universidad Complutense de Madrid Madrid, Spain M.D. Medicine 2007 - 2013 Completed clinical rotations in various specialties, focusing on family medicine and public health."
gps-car-navigation-installer,"Contact [email protected] +34 612 345 678 Skills • GPS Installation • Automotive Electronics • Technical Support • Customer Training • Problem Solving Luis Martínez Madrid, Spain | himalayas.app/@luismartinez Experienced Senior GPS Car Navigation Installer with over 7 years in automotive technology. Proven track record in successfully installing high-end navigation systems, optimizing vehicle performance, and enhancing user experience through expert technical support and training. Professional Experience AutoTech Solutions Madrid, Spain Senior GPS Car Navigation Installer Mar 2021 - Present Installed navigation systems in over 500 vehicles, achieving a 98% customer satisfaction rating. Developed and implemented training programs for junior installers, improving team efficiency by 30%. Collaborated with automotive manufacturers to integrate GPS systems into new car models, enhancing functionality and user interface. NavTech Installations Barcelona, Spain GPS Car Navigation Installer Jan 2016 - Feb 2021 Successfully installed and calibrated over 1000 GPS units across various car brands. Provided technical support and troubleshooting for customers, reducing service call response time by 40%. Conducted on-site training for customers to maximize the use of navigation systems, leading to a 20% increase in system usage ratings. Education Barcelona Technical Institute Barcelona, Spain Diploma in Automotive Technology 2013 - 2015 Focused on automotive electronics and advanced installation techniques, with hands-on training in navigation systems."
gaffer,"Contact [email protected] +86 138 0000 0000 Skills • Lighting Design • Electrical Setup • Team Management • Cinematography • Visual Storytelling Mei Wong Beijing, China | himalayas.app/@mei.wong Creative and detail-oriented Gaffer with over 6 years of experience in lighting design and execution for various film and television projects. Proven ability to manage lighting crews, design complex lighting setups, and collaborate effectively with directors and cinematographers to achieve stunning visual storytelling. Professional Experience Dragon Studios Beijing, China Gaffer Mar 2021 - Present Designed and implemented lighting setups for over 20 feature films and TV series, enhancing visual narratives and mood. Managed a team of 5 lighting technicians, ensuring efficient workflow and safety on set. Collaborated closely with cinematographers and directors to achieve desired lighting effects, contributing to award-winning productions. Silver Screen Productions Shanghai, China Lighting Technician Jun 2018 - Feb 2021 Assisted in the setup and operation of lighting equipment for various projects across film and commercials. Executed lighting plans as per director’s vision, contributing to the success of 15+ commercial campaigns. Maintained and organized lighting equipment inventory, reducing downtime by 25% during shoots. Education Beijing Film Academy Beijing, China B.A. Film Production 2014 - 2018 Focused on cinematography and lighting design, graduating with honors and producing a thesis film that showcased innovative lighting techniques."
gaffer,"Contact [email protected] +65 9123 4567 Skills • Lighting Design • Equipment Setup • Team Collaboration • Electrical Safety • Problem Solving • Film Production John Tan Singapore | himalayas.app/@johntan Dedicated Assistant Gaffer with over 5 years of experience in film and television production. Proficient in managing lighting setups and assisting the Gaffer to create visually stunning scenes. Proven track record of working collaboratively on set to ensure efficient and safe lighting operations. Professional Experience DreamWorks Studios Singapore Assistant Gaffer Feb 2021 - Present Assisted Gaffer in designing and implementing lighting setups for over 15 feature films and television series. Contributed to a 30% increase in on-set efficiency by organizing lighting equipment and streamlining workflow. Collaborated with the cinematography team to ensure the desired lighting effects were achieved for various scenes. Silver Screen Productions Singapore Lighting Technician May 2018 - Jan 2021 Setup and maintained lighting equipment for numerous commercials and short films. Assisted in the training of new team members on lighting techniques and safety protocols. Achieved a 25% reduction in lighting setup time by implementing new organizational strategies for equipment. Education Singapore Polytechnic Singapore Diploma in Film Production 2015 - 2017 Focused on cinematography, lighting design, and production management with hands-on experience in film sets."
galactic-astronomer,"Contact [email protected] +61 2 1234 5678 Skills • Research Leadership • Galactic Dynamics • Data Analysis • Astronomical Simulations • Grant Writing • Public Speaking • Mentorship Emily Johnson Canberra, ACT | himalayas.app/@emilyjohnson Dynamic and accomplished Research Director with over 10 years of experience in Galactic Astronomy. Proven track record of leading groundbreaking research projects, publishing in high-impact journals, and securing substantial funding for astronomical studies. Passionate about mentoring the next generation of scientists and fostering collaborative research. Professional Experience Australian Space Agency Canberra, ACT Research Director Mar 2020 - Present Led a multi-disciplinary team of 15 researchers in the study of dark matter and galaxy formation, resulting in 5 publications in top-tier journals. Secured $3 million in funding from national grants to expand research capabilities and enhance observational tools. Developed collaborative programs with international space agencies, increasing research visibility and opportunities for data sharing. Australian National University Canberra, ACT Senior Research Scientist Jan 2015 - Feb 2020 Conducted extensive research on the dynamics of galaxy clusters, contributing to the understanding of cosmic evolution. Published 10 peer-reviewed articles and presented findings at international conferences, enhancing institutional reputation. Mentored graduate students in research methodologies and data analysis techniques, fostering academic growth. Education University of Sydney Sydney, NSW Ph.D. Astronomy 2010 - 2014 Dissertation focused on the influence of dark energy on galactic structures. Conducted advanced simulations and observational studies."
galactic-astronomer,"Contact [email protected] +39 055 123 4567 Skills • Astrophysics • Exoplanet Research • Data Analysis • Cosmology • Scientific Writing Elena Rossi Rome, Italy | himalayas.app/@elenarossi Accomplished Principal Galactic Astronomer with over 10 years of experience in astrophysics and space exploration. Proven track record of leading groundbreaking research projects, publishing influential papers, and collaborating with international space agencies to advance our understanding of the universe. Professional Experience Galactic Research Institute Rome, Italy Principal Galactic Astronomer Mar 2019 - Present Led a team in the discovery of over 50 exoplanets, enhancing our knowledge of planetary systems. Published 15 peer-reviewed papers in leading astronomical journals, significantly contributing to the field of astrobiology. Collaborated with NASA on the Exoplanet Exploration Program, improving detection methods for distant worlds. European Space Agency Paris, France Astrophysicist Jan 2015 - Feb 2019 Conducted extensive research on cosmic microwave background radiation, leading to new insights in cosmology. Presented findings at various international conferences, enhancing collaboration with global scientific communities. Developed innovative models for star formation in different galactic environments, influencing future research directions. Education University of Bologna Bologna, Italy Ph.D. Astrophysics 2010 - 2015 Focused on the dynamics of exoplanetary systems and their potential for habitability. Research published in several high-impact journals."
galactic-astronomer,"Contact [email protected] +49 151 12345678 Skills • Astrophysics • Data Analysis • Computational Modeling • Research Leadership • Cosmic Phenomena • Project Management Anna Müller Heidelberg, Germany | himalayas.app/@annamueller Dedicated and innovative Lead Galactic Astronomer with over 10 years of experience in astrophysical research and cosmic data analysis. Proven track record in leading groundbreaking projects and collaborations that enhance our understanding of the universe. Professional Experience Max Planck Institute for Astronomy Heidelberg, Germany Lead Galactic Astronomer Apr 2020 - Present Successfully led a team of 15 researchers in the study of dark matter distribution in galaxy clusters, contributing to a significant publication in 'Nature Astronomy' Implemented innovative data visualization techniques, improving analysis efficiency by 30% Collaborated with international space agencies on the development of a new satellite-based observatory for deep-space observations European Southern Observatory Garching, Germany Senior Astronomer Jan 2015 - Mar 2020 Conducted extensive research on exoplanetary atmospheres, leading to the discovery of new atmospheric signatures Published over 20 peer-reviewed articles in top-tier journals, enhancing the institute's reputation in the astronomical community Organized and led workshops for young astronomers, fostering talent and collaboration in the field Heidelberg University Heidelberg, Germany Research Fellow May 2012 - Dec 2014 Investigated the formation and evolution of star clusters, contributing to key findings in astrophysical models Developed computational models that are now widely used in galactic dynamics research Education Ludwig Maximilian University of Munich Munich, Germany Ph.D. in Astrophysics 2008 - 2012 Research focused on galaxy formation and evolution, with a dissertation on the role of dark matter in cosmic structures. University of Heidelberg Heidelberg, Germany M.Sc. in Physics 2006 - 2008 Specialized in theoretical astrophysics and computational physics."
galactic-astronomer,"Contact [email protected] +81 (90) 1234-5678 Skills • Astrophysics • Data Analysis • Programming (Python, R) • Telescope Operations • Research Methodologies • Scientific Writing • Team Leadership Hiroshi Tanaka Tokyo, Japan | himalayas.app/@hiroshitanaka Dedicated Senior Galactic Astronomer with over 10 years of experience in astrophysics, specializing in the study of exoplanets and their atmospheres. Proven track record of leading groundbreaking research projects and contributing to significant discoveries in the field of astronomy. Professional Experience AstroInnovations Tokyo, Japan Senior Galactic Astronomer Apr 2020 - Present Led a team of researchers in the discovery of 15 new exoplanets using advanced telescopic techniques. Published over 20 peer-reviewed papers in prestigious journals, contributing to the global understanding of planetary systems. Developed innovative algorithms for data analysis that increased detection rates of exoplanets by 30%. Galactic Research Institute Kyoto, Japan Astrophysicist Jun 2015 - Mar 2020 Conducted extensive research on stellar evolution, focusing on the lifecycle of stars and their planetary systems. Collaborated with international teams on the Kepler Space Telescope project, contributing to the identification of habitable zones. Presented findings at multiple international astronomy conferences, enhancing institutional visibility. Education University of Tokyo Tokyo, Japan Ph.D. in Astrophysics 2011 - 2015 Research focused on exoplanet atmospheres and their potential for habitability. Recipient of the University Fellowship for outstanding research."
galley-cook,"Contact [email protected] +49 151 1234 5678 Skills • Menu Development • Food Safety Management • Culinary Techniques • Team Leadership • Inventory Management Maximilian Müller Hamburg, Germany | himalayas.app/@maximilianmueller Dedicated and skilled Senior Galley Cook with over 10 years of experience in high-pressure culinary environments. Proven track record of creating innovative menus while ensuring compliance with food safety standards. Passionate about providing exceptional dining experiences aboard luxury cruise liners. Professional Experience Hapag-Lloyd Cruises Hamburg, Germany Senior Galley Cook Mar 2019 - Present Designed and executed seasonal menus for a 5-star cruise line, enhancing guest satisfaction by 30% Implemented rigorous food safety protocols, resulting in zero health violations during inspections Supervised a team of 10 kitchen staff, fostering a collaborative and efficient work environment Royal Caribbean International Miami, FL, USA Galley Cook May 2015 - Feb 2019 Prepared high-volume meals for up to 300 guests daily, maintaining high culinary standards Assisted in menu planning and inventory management, reducing food waste by 25% Participated in training programs for junior cooks to enhance their culinary skills Culinary Institute of America Hyde Park, NY, USA Culinary Intern Jun 2014 - Dec 2014 Gained hands-on experience in various kitchen stations, mastering cooking techniques and food preparation Assisted chefs in preparing gourmet dishes for special events and banquets Education Le Cordon Bleu Paris, France Diploma in Culinary Arts 2012 - 2014 Comprehensive training in classical and contemporary culinary techniques, with a focus on French cuisine."
galvanizer,"Contact [email protected] +1 (555) 987-6543 Skills • Galvanizing Processes • Quality Control • Team Leadership • Safety Management • Process Improvement Emily Johnson Houston, TX | himalayas.app/@emilyjohnson Dedicated Galvanizing Supervisor with over 6 years of experience in the galvanizing industry. Proven track record in enhancing production processes, ensuring quality standards, and leading teams to achieve operational excellence. Professional Experience Steel Innovations Inc. Houston, TX Galvanizing Supervisor May 2021 - Present Supervised a team of 15 in galvanizing operations, achieving a 25% increase in production efficiency. Implemented quality control measures that reduced defects by 30%, enhancing customer satisfaction. Trained new staff on safety protocols and operating procedures, improving workplace safety compliance by 40%. GalvaTech Solutions Dallas, TX Galvanizing Technician Feb 2018 - Apr 2021 Operated galvanizing equipment and performed routine maintenance to ensure optimal performance. Assisted in the development of a new pre-treatment process that cut processing time by 20%. Collaborated with quality assurance to conduct tests and ensure compliance with industry standards. Education Texas A&M University College Station, TX B.S. in Industrial Engineering 2014 - 2018 Specialized in manufacturing processes and quality control systems."
