Category,Text
gastroenterology-professor,"Contact [email protected] +86 138 0013 4567 Skills • Gastroenterology • Endoscopy • Clinical Research • Patient Care • Medical Education • Invasive Procedures • Data Analysis Dr. Mei Lin Beijing, China | himalayas.app/@meilin Accomplished Gastroenterologist with over 15 years of experience in clinical practice and research. Renowned for innovative approaches in the diagnosis and treatment of gastrointestinal disorders, and a strong advocate for advancing medical education and research in gastroenterology. Professional Experience Peking University Health Science Center Beijing, China Endowed Chair in Gastroenterology Jun 2020 - Present Developed a comprehensive research program focusing on inflammatory bowel disease, resulting in over 30 published papers in high-impact journals Implemented innovative treatment protocols that improved patient outcomes by 25% Established a fellowship program, mentoring over 10 gastroenterology fellows annually Shanghai Jiao Tong University School of Medicine Shanghai, China Associate Professor of Gastroenterology Jan 2015 - May 2020 Conducted groundbreaking research in liver disease that led to new treatment guidelines adopted nationally Presented findings at international conferences, enhancing the institution's global reputation in gastroenterology Led a multidisciplinary team to improve the management of gastrointestinal cancers, reducing late-stage diagnoses by 15% Beijing Tongren Hospital Beijing, China Consultant Gastroenterologist Aug 2010 - Dec 2014 Provided expert clinical care for patients with complex gastrointestinal issues, achieving a 95% patient satisfaction rate Conducted over 100 endoscopic procedures annually with a complication rate significantly below national average Developed patient education materials that improved adherence to treatment plans by 30% Education Fudan University Shanghai, China M.D. in Gastroenterology 2005 - 2010 Completed a rigorous program focusing on gastrointestinal diseases, culminating in a thesis on advanced endoscopic techniques. Peking University Beijing, China Ph.D. in Medical Sciences 2012 - 2016 Focused research on the molecular mechanisms of gastrointestinal cancers, contributing to significant advancements in treatment strategies."
gastroenterology-professor,"Contact [email protected] +44 20 7946 0950 Skills • Gastroenterology • Endoscopy • Clinical Research • Medical Education • Patient Care • Inflammatory Bowel Disease Dr. Emma Thompson London, UK | himalayas.app/@dr-emmathompson Acclaimed Gastroenterologist and educator with over 15 years of experience in clinical practice and research. Renowned for pioneering studies in inflammatory bowel disease and advanced endoscopic techniques. Committed to training the next generation of medical professionals through hands-on education and mentorship. Professional Experience Imperial College London London, UK Distinguished Professor of Gastroenterology Sep 2018 - Present Led a groundbreaking study on the genetic factors of Crohn's disease, resulting in a 30% increase in diagnostic accuracy. Implemented advanced endoscopic training programs that improved procedural success rates by 25% among trainees. Published over 50 peer-reviewed articles in top-tier gastroenterology journals, significantly impacting clinical practices. University College London Hospitals London, UK Consultant Gastroenterologist Apr 2013 - Aug 2018 Managed a diverse patient caseload, achieving a 95% patient satisfaction rate through comprehensive care. Developed and led a multidisciplinary team focused on inflammatory bowel disease management, reducing hospital readmission rates by 20%. Presented research findings at international gastroenterology conferences, enhancing the institution's visibility and reputation. King's College London London, UK Senior Lecturer in Gastroenterology Jan 2009 - Mar 2013 Conducted research on gut microbiota's role in gastrointestinal diseases, leading to innovative treatment approaches. Supervised PhD candidates, fostering a collaborative research environment and enhancing academic outcomes. Developed undergraduate and postgraduate curricula, improving student engagement and knowledge retention. Education University of London London, UK M.D. Gastroenterology 2005 - 2009 Specialized training in gastroenterology with a focus on advanced endoscopic techniques and inflammatory bowel disease. University of Cambridge Cambridge, UK B.Sc. Medicine 2001 - 2005 Comprehensive medical training with honors, emphasizing clinical skills and patient care."
gastroenterology-professor,"Contact [email protected] +44 20 7946 0958 Skills • Gastroenterology • Research Leadership • Clinical Education • Patient Care • Advanced Endoscopy • Publications • Grant Writing Dr. James Smith London, UK | himalayas.app/@drjamesmith Dedicated and accomplished Professor of Gastroenterology with over 15 years of experience in clinical practice and academic research. Renowned for contributions to the field of gastroenterology, particularly in inflammatory bowel disease and liver disorders. Committed to advancing medical education and patient care through innovative research and interdisciplinary collaboration. Professional Experience Imperial College London London, UK Professor of Gastroenterology Sep 2018 - Present Led a multidisciplinary team in groundbreaking research on the pathogenesis of inflammatory bowel disease, resulting in 15 published papers in high-impact journals. Developed and implemented a new curriculum for the Gastroenterology Fellowship program, enhancing training for 30+ fellows annually. Secured £2M in research funding from the UK Research and Innovation for studies on gut microbiome and its impact on health. King's College Hospital London, UK Consultant Gastroenterologist Apr 2013 - Aug 2018 Managed a diverse caseload of gastrointestinal disorders, improving patient outcomes through evidence-based treatment strategies. Implemented a hospital-wide protocol for the management of liver diseases which reduced hospital readmission rates by 25%. Supervised and trained junior doctors and medical students in clinical gastroenterology. Education University College London London, UK M.D. Medicine 2002 - 2007 Graduated with honors, focusing on gastroenterology and hepatology. Completed various clinical rotations in related specialties. University of Cambridge Cambridge, UK Ph.D. Gastroenterology 2008 - 2012 Conducted research on the molecular mechanisms of inflammatory bowel disease, resulting in several peer-reviewed publications."
gate-agent,"Contact [email protected] +55 11 91234-5678 Skills • Customer Service • Team Leadership • Operational Efficiency • Conflict Resolution • Time Management Fernanda Silva São Paulo, SP | himalayas.app/@fernandasilva Dedicated Lead Gate Agent with over 6 years of experience in airport operations and exceptional customer service. Proven track record in leading teams to enhance passenger experience and streamline boarding procedures, contributing to operational efficiency and customer satisfaction. Professional Experience TAM Airlines São Paulo, SP Lead Gate Agent Mar 2019 - Present Supervised a team of 10 gate agents, ensuring compliance with safety and operational protocols. Implemented a new boarding process that reduced boarding time by 25%, enhancing on-time departures. Resolved passenger issues and complaints, maintaining a customer satisfaction score of 95%. Gol Linhas Aéreas Rio de Janeiro, RJ Gate Agent Jan 2017 - Feb 2019 Assisted in the smooth operation of gate activities, including check-in and boarding procedures. Trained new staff members on procedures and customer service excellence, contributing to team performance improvements. Managed passenger boarding and ensured accurate manifest for flights. Education Universidade Anhembi Morumbi São Paulo, SP Bachelor's Degree in Hospitality Management 2013 - 2017 Studied key principles of hospitality and customer service management, with a focus on airline and airport operations."
gate-agent,"Contact [email protected] +55 21 98765-4321 Skills • Customer Service • Operational Efficiency • Boarding Management • Conflict Resolution • Team Leadership Ana Silva São Paulo, SP | himalayas.app/@anasilva Dedicated Senior Gate Agent with over 6 years of experience in the airline industry, known for exceptional customer service and operational excellence. Proven ability to manage boarding processes efficiently and resolve passenger issues promptly, contributing to enhanced passenger satisfaction and streamlined airport operations. Professional Experience Latam Airlines São Paulo, SP Senior Gate Agent Jun 2020 - Present Managed boarding for over 150 flights monthly, ensuring on-time departures and maximizing passenger flow. Implemented new boarding procedures that reduced wait times by 30% and improved overall customer satisfaction ratings. Trained and mentored 10 new gate agents, enhancing team performance and service quality. Avianca Brasil Rio de Janeiro, RJ Gate Agent Jan 2017 - May 2020 Coordinated boarding processes for domestic and international flights, ensuring compliance with safety and security protocols. Assisted passengers with special needs, enhancing their travel experience and receiving commendations from management. Resolved customer complaints effectively, maintaining high levels of passenger satisfaction. Education Universidade Federal do Rio de Janeiro Rio de Janeiro, RJ Bachelor's Degree in Tourism Management 2013 - 2016 Focus on customer service, travel industry operations, and logistics management."
gate-agent,"Contact [email protected] +44 20 7946 0958 Skills • Customer Service • Problem Solving • Communication • Teamwork • Attention to Detail James Smith London, England | himalayas.app/@jamessmith Enthusiastic and detail-oriented Junior Gate Agent with over 2 years of experience in the aviation industry. Adept at ensuring smooth boarding processes and enhancing passenger experiences while maintaining safety and compliance with airline policies. Professional Experience British Airways London Heathrow Airport, England Junior Gate Agent Jun 2022 - Present Assisted in boarding procedures for flights with up to 300 passengers, ensuring timely departures. Resolved passenger inquiries and issues, achieving a customer satisfaction score of 95%. Collaborated with flight crews and ground staff to coordinate efficient boarding and deplaning processes. EasyJet London Luton Airport, England Airport Operations Assistant Jan 2021 - May 2022 Monitored flight schedules and communicated updates to passengers, improving overall communication efficiency. Supported check-in operations, handling passenger luggage and ensuring compliance with safety regulations. Trained new staff on operational procedures and customer service excellence. Education City of Westminster College London, England BTEC Level 3 Diploma in Travel and Tourism 2018 - 2020 Completed coursework in customer service, aviation operations, and tourism management."
gear-cutter,"Contact [email protected] +33 6 12 34 56 78 Skills • CNC Machining • Gear Design • Quality Assurance • Precision Engineering • Tooling and Fixture Design Thomas Dupont Paris, France | himalayas.app/@thomasdupont Dedicated Senior Gear Cutter with over 10 years of experience in the automotive manufacturing industry. Expertise in the design, production, and quality assurance of precision gears, contributing to enhanced performance and reliability in automotive applications. Professional Experience Renault Paris, France Senior Gear Cutter Mar 2019 - Present Executed precision cutting of gears for high-performance automotive engines, improving efficiency by 15%. Implemented advanced CNC machining techniques, reducing production time by 30%. Collaborated with the engineering team to develop new gear designs, which enhanced product durability and reduced wear. Peugeot Sochaux, France Gear Cutter Jan 2015 - Feb 2019 Produced high-precision gears for various automotive applications, achieving a defect rate of less than 2%. Participated in the transition to automated gear cutting processes, increasing production capacity by 25%. Trained and mentored junior operators in gear manufacturing techniques and safety protocols. Education Lycée Technique de Saint-Denis Saint-Denis, France Bac Pro Technicien d'Usinage 2010 - 2013 Specialization in machining techniques, focusing on gear cutting and precision engineering."
gear-cutter,"Contact [email protected] +52 55 1234 5678 Skills • CNC Machining • Gear Cutting • Blueprint Reading • Quality Assurance • Metrology Luis Hernández Monterrey, Nuevo León | himalayas.app/@luishernandez Dedicated Junior Gear Cutter with over 2 years of experience in the manufacturing industry, specializing in precision gear fabrication. Proven ability to operate CNC machines and perform quality inspections to ensure high standards of production. Professional Experience Precision Gears Inc. Monterrey, Nuevo León Junior Gear Cutter Jan 2022 - Present Operated CNC gear cutting machines to manufacture high-precision gears for automotive applications. Maintained a 98% quality assurance rate by performing regular equipment checks and inspections. Assisted in the optimization of machining processes, resulting in a 15% reduction in material waste. GearWorks Ltd. Monterrey, Nuevo León Machining Apprentice Jun 2020 - Dec 2021 Supported senior machinists in the setup and operation of gear cutting equipment. Learned to read and interpret technical blueprints and specifications for gear production. Contributed to team projects that improved production efficiency by 10%. Education Monterrey Institute of Technology Monterrey, Nuevo León Technical Diploma in Machining 2018 - 2020 Completed coursework in CNC machining, metallurgy, and quality control in manufacturing processes."
gear-machinist,"Contact [email protected] +55 11 91234-5678 Skills • CNC Machining • Team Leadership • Quality Control • Process Optimization • Gear Design • Blueprint Reading • Problem Solving Ana Pereira São Paulo, SP | himalayas.app/@anapereira Dedicated and detail-oriented Lead Gear Machinist with over 10 years of experience in high-precision machining and team leadership. Proven track record of improving manufacturing processes and enhancing product quality in the gear production sector. Professional Experience GearTech Industries São Paulo, SP Lead Gear Machinist May 2020 - Present Supervised a team of 15 machinists, achieving a 25% increase in production efficiency through enhanced workflow processes. Implemented quality control measures that reduced defects by 30%, significantly lowering rework costs. Designed and optimized machining programs for CNC lathes and mills, improving cycle times by 20%. Precision Gear Works Belo Horizonte, MG Senior Gear Machinist Mar 2015 - Apr 2020 Operated CNC machines to fabricate high-precision gears, ensuring adherence to strict tolerances. Trained and mentored junior machinists on best practices and safety protocols. Reduced setup times by 15% through implementation of new tooling techniques. Machinery Solutions Inc. Curitiba, PR Machinist Jan 2012 - Feb 2015 Worked on manual and CNC machines, producing components for automotive applications. Contributed to process improvement initiatives that enhanced throughput by 10%. Education Federal Institute of Education, Science and Technology São Paulo, SP Technical Diploma in Mechanical Engineering 2008 - 2011 Focused on machine design and manufacturing processes, with hands-on training in machining and CNC operation."
gear-machinist,"Contact [email protected] +86 138 0013 4567 Skills • CNC Machining • Gear Design • Precision Measurement • Quality Control • Manufacturing Process Improvement Li Wei Dalian, Liaoning, China | himalayas.app/@liwei Detail-oriented Gear Machinist with over 6 years of experience in the manufacturing industry, specializing in the production and repair of precision gears. Proven track record of enhancing manufacturing processes and ensuring product quality through meticulous attention to detail and machine optimization. Professional Experience Dalian Heavy Machinery Co. Dalian, Liaoning, China Senior Gear Machinist Apr 2020 - Present Operated CNC machines to produce high-precision gears for heavy machinery, achieving a 15% reduction in material waste. Implemented process improvements that increased production efficiency by 20% while maintaining strict compliance with quality standards. Trained and supervised a team of 4 junior machinists in gear production techniques and safety protocols. Shenzhen Precision Engineering Shenzhen, Guangdong, China Gear Machinist Feb 2017 - Mar 2020 Produced custom gears and components for various industrial applications using both manual and CNC milling machines. Conducted quality control inspections, ensuring that all products met specifications and performance standards. Collaborated with engineers to optimize gear design, leading to a 30% improvement in durability for specific applications. Education Dalian Polytechnic University Dalian, Liaoning, China Diploma in Mechanical Engineering 2014 - 2017 Focused on manufacturing processes, materials science, and machining techniques. Completed hands-on projects in gear design and production."
gem-cutter,"Contact [email protected] +1 (555) 987-6543 Skills • Precision Cutting • Polishing Techniques • Gemstone Identification • Quality Control • Custom Design Michael Thompson New York, NY | himalayas.app/@michaelthompson Highly skilled Master Gem Cutter with over 10 years of experience in crafting exquisite gemstones. Proven track record of transforming raw stones into breathtaking works of art, maximizing brilliance and clarity while minimizing waste. Recognized for exceptional attention to detail and commitment to quality. Professional Experience GemCraft Inc. New York, NY Master Gem Cutter Mar 2018 - Present Expertly cut and polished over 1,000 gemstones, achieving a 98% customer satisfaction rate. Developed and implemented innovative cutting techniques that increased yield by 25%. Trained and mentored a team of 5 junior cutters, enhancing their skills and efficiency. Precious Stones Co. Los Angeles, CA Senior Gem Cutter Jan 2014 - Feb 2018 Specialized in the cutting of high-value gemstones, increasing overall sales by 30% through superior craftsmanship. Collaborated with gemologists to select premium stones and design custom cuts for clients. Reduced cutting waste by 15% through meticulous planning and execution of cutting strategies. Education Gemological Institute of America Carlsbad, CA Diploma in Gemology 2011 - 2012 Completed comprehensive training in gemstone identification, grading, and cutting."
gem-cutter,"Contact [email protected] +34 612 345 678 Skills • Gemstone Identification • Precision Cutting • Polishing Techniques • Attention to Detail • Basic Metalworking Lucas Martinez Barcelona, Spain | himalayas.app/@lucasmartinez Passionate and detail-oriented Apprentice Gem Cutter with a strong foundation in gemstone identification and cutting techniques. Committed to honing skills in the art of gem cutting while contributing to high-quality craftsmanship. Professional Experience GemMasters Barcelona, Spain Apprentice Gem Cutter Jan 2023 - Present Assisted senior gem cutters in shaping and polishing various gemstones, ensuring precision and quality. Learned to operate cutting tools and polishing machines while adhering to safety standards. Participated in training sessions on gemstone identification and grading, enhancing product knowledge. JewelryArtisans Madrid, Spain Jewelry Apprentice Jun 2022 - Dec 2022 Supported the design and assembly of custom jewelry pieces, gaining hands-on experience in the jewelry-making process. Learned basic metalworking techniques and gemstone setting under the guidance of experienced jewelers. Assisted in inventory management and customer service, enhancing communication skills. Education Barcelona School of Gemology Barcelona, Spain Vocational Training in Gemology 2022 - 2023 Focused on gemstone identification, cutting techniques, and jewelry design. Completed practical projects on gem cutting."
gemologist,"Contact [email protected] +86 138 0000 0000 Skills • Gemstone Appraisal • Quality Assurance • Team Leadership • Gemological Research • Client Education Li Wei Beijing, China | himalayas.app/@liwei Experienced Chief Gemologist with over 10 years of expertise in gemology and jewelry appraisal. Proven track record of leading gemological teams, enhancing quality standards, and driving educational initiatives to promote gemological knowledge within the luxury market. Professional Experience Baiyun Jewelers Beijing, China Chief Gemologist May 2020 - Present Led a team of 15 gemologists in the evaluation and certification of over 10,000 gemstones annually. Implemented advanced gemological technologies resulting in a 30% increase in appraisal accuracy. Developed and delivered training programs for staff and clients, improving gemological knowledge across the organization. China Gemological Institute Shanghai, China Senior Gemologist Jan 2015 - Apr 2020 Conducted research on gemstone treatments and enhancements, contributing to industry publications. Provided expert consultations for high-value gemstone transactions. Established a mentorship program for junior gemologists, fostering professional development. Education Gemological Institute of America Carlsbad, CA, USA M.S. Gemology 2012 - 2014 Focused on diamond grading, colored stones, and advanced gemological techniques."
gemologist,"Contact [email protected] +81 (0)3 1234 5678 Skills • Gemstone Appraisal • Gem Identification • Customer Service • Sales Strategy • Team Training • Market Analysis Hiroshi Tanaka Tokyo, Japan | himalayas.app/@hiroshit Highly skilled Senior Gemologist with over 10 years of experience in gemstone evaluation, certification, and sales. Proven track record of increasing revenue through expert advice and superior customer service in a prestigious luxury retail environment. Professional Experience Tiffany & Co. Tokyo, Japan Senior Gemologist Feb 2018 - Present Conducted detailed gemstone appraisals for luxury jewelry pieces, achieving a 95% customer satisfaction rate. Trained and mentored a team of 4 junior gemologists, enhancing their appraisal skills and product knowledge. Collaborated with the marketing team to develop promotional strategies that increased gemstone sales by 30% year-over-year. Mikimoto Tokyo, Japan Gemologist May 2014 - Jan 2018 Performed accurate evaluations of pearls and gemstones, ensuring quality and authenticity. Developed educational materials for customers, improving their understanding of pearl care and valuation. Participated in international trade shows, representing the company and expanding its network. Education Gemmological Institute of America (GIA) Carlsbad, CA, USA B.S. Gemology 2008 - 2012 Focused on diamond grading, colored stones, and pearl identification. Completed extensive hands-on training and examinations."
gemologist,"Contact [email protected] +34 612 345 678 Skills • Gemstone Identification • Gem Grading • Customer Service • Laboratory Techniques • Gemstone Appraisal Carlos Martínez Madrid, Spain | himalayas.app/@carlosmartinez Dedicated Junior Gemologist with a solid foundation in gemstone evaluation and identification. Experienced in using advanced gemological instruments and techniques to assess quality and authenticity. Passionate about the jewelry industry and committed to delivering exceptional customer service. Professional Experience De Beers Group Madrid, Spain Junior Gemologist May 2022 - Present Assisted in the evaluation and certification of over 500 gemstones monthly Utilized advanced gemological tools such as spectroscopes and refractometers to analyze gemstones Provided customers with detailed reports on gemstone quality and value, enhancing customer satisfaction by 30% Gemology Institute of Spain Barcelona, Spain Gemology Intern Jun 2021 - Apr 2022 Conducted hands-on analysis and classification of various gemstones under the supervision of senior gemologists Participated in workshops that improved expertise in gemstone grading and market valuation Assisted in maintaining the laboratory's inventory and documentation processes Education University of Barcelona Barcelona, Spain B.Sc. Gemology 2018 - 2022 Studied various aspects of gemology, including gemstone identification, grading, and valuation. Completed practical training in gemstone analysis."
