Category,Text
game-designer,"Contact [email protected] +49 151 12345678 Skills • Game Design • User Experience • Prototyping • Team Leadership • Player Engagement • Narrative Development Laura Schmidt Berlin, Germany | himalayas.app/@lauraschmidt Creative and results-oriented Lead Game Designer with over 10 years of experience in the gaming industry. Proven track record of leading design teams to develop engaging game mechanics and narratives that enhance player experience and drive engagement. Professional Experience Epic Games Berlin, Germany Lead Game Designer Mar 2021 - Present Directed the design of a top-grossing mobile game with over 5 million downloads within the first month of launch Collaborated with cross-functional teams to create innovative gameplay features, increasing user retention by 30% Mentored and managed a team of designers, fostering a culture of creativity and collaboration Ubisoft Düsseldorf, Germany Senior Game Designer Jul 2016 - Feb 2021 Designed and implemented gameplay systems for several AAA titles, enhancing player engagement and satisfaction Conducted player testing and feedback sessions to refine game mechanics, resulting in a 25% increase in positive reviews Worked closely with artists and programmers to ensure cohesive game design Blue Byte Düsseldorf, Germany Game Designer Jan 2013 - Jun 2016 Developed engaging storylines and character arcs for various strategy games, contributing to a 15% increase in sales Created detailed design documents and prototypes to communicate concepts effectively Participated in brainstorming sessions that led to innovative game features adopted in future projects Education Games Academy Berlin, Germany M.A. Game Design 2011 - 2013 Focused on game mechanics, storytelling, and user experience design. Completed a thesis on player engagement strategies in online multiplayer games. University of Potsdam Potsdam, Germany B.A. Media Studies 2007 - 2011 Concentrated on digital media and interactive design. Participated in various projects that involved game development and interactive storytelling."
game-designer,"Contact [email protected] +49 170 1234567 Skills • Level Design • Game Mechanics • User Experience Design • Prototyping • Unity • Storytelling • Player Feedback Analysis Anna Müller Berlin, Germany | himalayas.app/@annamueller Innovative Game Designer with over 5 years of experience in the gaming industry, specializing in level design and user experience. Proven track record of delivering compelling gameplay experiences that drive player engagement and satisfaction. Professional Experience Epic Games Berlin, Germany Game Designer May 2021 - Present Designed and implemented engaging game levels for popular titles, achieving an average player rating of 4.8/5. Collaborated with artists and developers to create interactive environments, enhancing the overall gameplay experience. Conducted player testing sessions to gather feedback, resulting in a 30% increase in player retention rates. Ubisoft Düsseldorf, Germany Junior Game Designer Jun 2018 - Apr 2021 Assisted in the development of game concepts and mechanics for a AAA title, contributing to a successful launch. Created design documentation and prototypes, facilitating clear communication among cross-functional teams. Participated in brainstorming sessions that produced innovative gameplay features enhancing player engagement. Education Berlin University of the Arts Berlin, Germany B.A. Game Design 2014 - 2018 Focused on interactive design and storytelling in games, completed a capstone project on player experience in narrative-driven games."
game-developer,"Contact [email protected] +44 20 7946 0958 Skills • C++ • Unity • Unreal Engine • Game Design • Agile Development • Artificial Intelligence • 3D Modeling Emily Johnson London, UK | himalayas.app/@emilyjohnson Innovative Senior Game Developer with over 7 years of experience in the gaming industry, specializing in game mechanics and player engagement. Proven track record of leading successful projects from concept to launch, and a passion for creating high-quality, visually stunning games. Professional Experience Epic Games London, UK Senior Game Developer Mar 2021 - Present Designed and implemented core gameplay mechanics for a AAA title that achieved 95% positive reviews. Led a team of 10 developers, fostering collaboration and enhancing productivity through Agile methodologies. Optimized game performance, resulting in a 30% increase in frame rates across platforms. Ubisoft Manchester, UK Game Developer Jan 2018 - Feb 2021 Contributed to the development of an award-winning multiplayer game, enhancing player interaction and engagement. Collaborated with artists and designers to create visually appealing environments and character designs. Implemented AI systems that improved NPC behaviors, leading to a more immersive gaming experience. Education University of Salford Salford, UK B.Sc. Computer Games Development 2012 - 2015 Specialized in game design and programming, completed a capstone project on virtual reality gaming."
game-programmer,"Contact [email protected] +81 90-1234-5678 Skills • C# • Unity • Game Development • Problem Solving • Collaboration • Debugging • Visual Effects Yuki Tanaka Tokyo, Japan | himalayas.app/@yukitanaka Enthusiastic Junior Game Programmer with 2 years of experience in game development and a strong foundation in C# and Unity. Committed to delivering high-quality code and collaborating effectively within a team to create immersive gaming experiences. Professional Experience NinjaSoft Studios Tokyo, Japan Junior Game Programmer Apr 2022 - Present Developed gameplay mechanics for an action-adventure game, enhancing player engagement and retention. Collaborated with artists and designers to implement visual effects and animations, resulting in a 20% increase in user satisfaction. Participated in code reviews and contributed to the development of best practices for the programming team. PixelPlay Osaka, Japan Game Development Intern Jun 2021 - Mar 2022 Assisted in the development of mobile games using Unity, gaining hands-on experience in C# programming. Tested and debugged game features, improving overall game performance and user experience. Worked closely with the QA team to ensure a bug-free launch of the game. Education Tokyo University of Technology Tokyo, Japan B.S. in Computer Science 2018 - 2022 Graduated with a focus on game development and software engineering. Completed a capstone project on AI-driven NPC behavior in video games."
game-show-host,"Contact [email protected] +39 06 1234 5678 Skills • Public Speaking • Audience Engagement • Content Creation • Television Production • Social Media Management Giulia Rossi Rome, Italy | himalayas.app/@giuliarossi Charismatic Game Show Host with over 5 years of experience in live television. Recognized for exceptional ability to connect with audiences and create an entertaining atmosphere. Proven track record of driving viewer ratings and engagement through innovative show formats and interactive segments. Professional Experience Rai Uno Rome, Italy Game Show Host May 2021 - Present Hosted the popular game show 'La Ruota della Fortuna', increasing viewer ratings by 30% during my tenure. Developed engaging content and interactive segments that fostered audience participation. Collaborated with producers and writers to create innovative game formats that enhanced entertainment value. Canale 5 Milan, Italy Assistant Game Show Host Mar 2018 - Apr 2021 Supported the lead host in the delivery of 'Avanti un Altro!', contributing to a 20% increase in audience engagement. Conducted pre-show interviews and helped develop interactive audience challenges. Managed social media engagement strategies that expanded the show's online presence. Education University of Rome Rome, Italy Bachelor's Degree in Communication 2014 - 2018 Focused on media studies and performance arts. Participated in various workshops and internships related to broadcasting and hosting."
game-tester,"Contact [email protected] +27 21 123 4567 Skills • Game Testing • Automation Testing • Bug Tracking • Team Management • Test Planning • Agile Methodologies • Gameplay Analysis Thandiwe Nkosi Cape Town, South Africa | himalayas.app/@thandiwenkosi Detail-oriented Quality Assurance Manager with over 7 years of experience in the gaming industry. Proven track record of leading QA teams to deliver high-quality gaming products through rigorous testing methodologies and innovative solutions, ensuring an exceptional player experience. Professional Experience Epic Games Cape Town, South Africa Quality Assurance Manager May 2021 - Present Managed a team of 15 QA analysts and testers to ensure the quality of multiple AAA game titles Implemented automated testing processes, reducing QA cycle time by 30% Collaborated with development teams to establish best practices for bug tracking and resolution, improving overall game stability Ubisoft Johannesburg, South Africa Senior Quality Assurance Tester Jan 2018 - Apr 2021 Conducted extensive functional and regression testing for various game titles, ensuring adherence to quality standards Developed and executed test plans and cases, achieving a bug detection rate of over 95% Trained junior testers on QA processes and tools, fostering team development and knowledge sharing Naughty Dog Los Angeles, CA, USA Quality Assurance Tester Jun 2015 - Dec 2017 Performed gameplay testing for various titles, identifying critical bugs and collaborating with developers for quick resolution Assisted in the creation of a new testing framework that improved testing efficiency by 25% Participated in weekly cross-department meetings to discuss progress and align on quality goals Education University of Cape Town Cape Town, South Africa B.Sc. Computer Science 2011 - 2014 Specialized in software development and testing methodologies, with a focus on game development."
game-tester,"Contact [email protected] +49 151 2345 6789 Skills • Game Testing • Bug Tracking • JIRA • Agile Methodologies • Test Automation • Performance Testing • Regression Testing Maximilian Müller Berlin, Germany | himalayas.app/@maxmueller Detail-oriented Quality Assurance Analyst with over 5 years of experience in the gaming industry. Expert in identifying bugs and ensuring product quality through rigorous testing methodologies. Proven track record of improving game performance and user experience by implementing effective QA processes. Professional Experience Epic Games Berlin, Germany Quality Assurance Analyst Mar 2021 - Present Conducted comprehensive testing on AAA titles, identifying critical bugs that improved user ratings by 30% Collaborated with developers to streamline the bug fixing process, reducing turnaround time by 25% Developed and maintained QA documentation and testing procedures, enhancing overall team efficiency Ubisoft Düsseldorf, Germany QA Tester Jan 2018 - Feb 2021 Performed functional, regression, and performance testing on multiple game titles Reported and tracked issues using JIRA, ensuring timely resolution and communication Participated in daily standups and sprint planning meetings, contributing to an agile development environment Education Technical University of Munich Munich, Germany B.Sc. Computer Science 2014 - 2018 Focused on software testing methodologies and game development principles. Completed a thesis on automated testing in video games."
game-tester,"Contact [email protected] +44 20 7946 0958 Skills • Bug Tracking • Gameplay Testing • Test Automation • Game Mechanics • Critical Thinking • Documentation James Smith London, UK | himalayas.app/@jamessmith Detail-oriented Game Tester with over 5 years of experience in quality assurance and gameplay testing for high-profile video games. Proven track record in identifying bugs, improving game functionality, and enhancing user experience through thorough testing processes. Professional Experience Epic Games London, UK Game Tester Jan 2022 - Present Conducted extensive gameplay testing for major titles, reporting over 200 critical bugs leading to significant improvements in game quality. Collaborated with developers to refine game mechanics and enhance player experience, resulting in a 30% increase in positive feedback from beta testers. Developed and maintained detailed test plans and documentation to streamline testing processes. Ubisoft Manchester, UK Quality Assurance Tester May 2018 - Dec 2021 Executed functional and regression testing on various game titles, identifying and documenting over 150 bugs. Worked closely with cross-functional teams to ensure game stability and performance across multiple platforms. Participated in daily stand-ups and sprint reviews to communicate testing progress and challenges effectively. Education University of Manchester Manchester, UK B.Sc. Computer Science 2014 - 2018 Focused on game design and software development. Completed a capstone project on game mechanics testing methodologies."
game-warden,"Contact [email protected] +1 (555) 987-6543 Skills • Wildlife Management • Law Enforcement • Environmental Education • Ecological Research • Public Relations Michael Thompson Toronto, ON | himalayas.app/@michaelthompson Dedicated Game Warden with over 6 years of experience in wildlife management and law enforcement. Proven track record in protecting natural resources, conducting inspections, and promoting conservation efforts within diverse communities. Professional Experience Ontario Ministry of Natural Resources and Forestry Toronto, ON Game Warden Mar 2019 - Present Conducted over 300 inspections of hunting and fishing licenses to ensure compliance with provincial regulations. Developed and led educational programs for local communities, increasing awareness of wildlife conservation by 50%. Collaborated with law enforcement agencies to investigate wildlife crimes, resulting in a 30% increase in successful prosecutions. Parks Canada Banff, AB Wildlife Technician May 2017 - Feb 2019 Assisted in the monitoring and management of wildlife populations in national parks across Alberta. Implemented conservation strategies that contributed to a 20% increase in local elk populations. Maintained accurate records of wildlife sightings and habitat conditions, aiding in the development of future management plans. Education University of Alberta Edmonton, AB Bachelor of Science in Wildlife Biology 2013 - 2017 Focused on wildlife conservation, ecology, and management practices. Completed extensive fieldwork and research projects related to Canadian fauna."
game-warden,"Contact [email protected] +52 55 1234 5678 Skills • Wildlife Management • Conservation Law • Ecological Research • Community Outreach • Data Collection Carlos Mendoza Mexico City, Mexico | himalayas.app/@carlosmendoza Dedicated Junior Game Warden with a strong commitment to wildlife preservation and environmental education. Experienced in supporting conservation programs and enforcing wildlife laws to ensure the sustainability of natural resources. Professional Experience Wildlife Conservation Agency Mexico City, Mexico Junior Game Warden Jan 2022 - Present Assisted in monitoring wildlife populations and habitats, contributing to a 15% increase in local biodiversity. Enforced wildlife protection laws, resulting in a 20% reduction in illegal poaching activities in protected areas. Conducted educational workshops for local communities to promote conservation awareness. EcoGuard Puebla, Mexico Wildlife Intern Jun 2021 - Dec 2021 Supported field research on endangered species, helping to gather data for conservation strategies. Participated in habitat restoration projects, improving ecosystem health in targeted regions. Assisted with public outreach initiatives to raise awareness about local wildlife conservation efforts. Education Universidad Nacional Autónoma de México Mexico City, Mexico B.S. in Wildlife Conservation 2018 - 2022 Focused on wildlife management, ecosystem restoration, and environmental policies. Engaged in various field studies and conservation projects."
garbage-collector,"Contact [email protected] +55 11 98765-4321 Skills • Waste Management • Sustainability • Recycling Programs • Team Leadership • Environmental Compliance Camila Oliveira São Paulo, Brazil | himalayas.app/@camilaoliveira Dynamic Waste Management Manager with over 7 years of experience in developing and implementing effective waste reduction strategies. Proven track record in leading teams to achieve sustainability goals while ensuring compliance with environmental regulations. Professional Experience EcoWaste Solutions São Paulo, Brazil Waste Management Manager Feb 2020 - Present Developed waste reduction programs that decreased landfill waste by 30% over 3 years Implemented recycling initiatives that improved recycling rates by 50% within the community Trained and supervised a team of 15 waste management staff, enhancing operational efficiency GreenEarth Services Rio de Janeiro, Brazil Environmental Consultant May 2017 - Jan 2020 Conducted waste audits for various companies, identifying key areas for waste reduction Advised on the implementation of sustainable practices leading to a 40% reduction in waste disposal costs Engaged with local government to promote community recycling programs Education University of São Paulo São Paulo, Brazil M.Sc. Environmental Science 2014 - 2016 Specialized in waste management and sustainable practices, focusing on recycling and resource recovery."
garbage-collector,"Contact [email protected] +61 4 1234 5678 Skills • Waste Management • Recycling Programs • Team Leadership • Route Optimization • Sustainability Initiatives James Anderson Melbourne, Australia | himalayas.app/@jamesanderson Dedicated and experienced Senior Garbage Collector with over 7 years in waste management and environmental services. Proven track record in optimizing collection routes, enhancing recycling programs, and leading teams to achieve operational efficiency and sustainability. Professional Experience CleanCity Services Melbourne, Australia Senior Garbage Collector Feb 2020 - Present Managed a team of 10 garbage collectors, improving team efficiency by 30% through effective training and route optimization. Implemented new recycling initiatives that increased community recycling rates by 25%. Conducted regular inspections of collection equipment, reducing maintenance costs by 15%. EcoWaste Solutions Sydney, Australia Garbage Collector Jan 2016 - Jan 2020 Executed daily garbage collection routes, ensuring timely and efficient waste disposal for residential and commercial clients. Participated in community outreach programs to educate residents on waste reduction and recycling practices. Maintained accurate records of collected waste volumes, contributing to annual sustainability reports. Education TAFE Queensland Brisbane, Australia Certificate III in Waste Management 2015 - 2016 Specialized training in waste management practices, environmental sustainability, and health and safety regulations."
garbage-truck-driver,"Contact [email protected] +1 (555) 987-6543 Skills • Route Optimization • Team Leadership • Safety Compliance • Customer Service • Vehicle Maintenance Jessica Miller Houston, TX | himalayas.app/@jessicamiller Dedicated and experienced Lead Garbage Truck Driver with over 10 years in waste management. Proven track record of improving route efficiency and ensuring compliance with safety regulations, while leading a team of drivers to achieve operational excellence. Professional Experience Waste Management Inc. Houston, TX Lead Garbage Truck Driver Apr 2018 - Present Supervised a team of 10 drivers, coordinating daily routes and schedules to optimize waste collection efficiency by 30%. Implemented safety training programs resulting in a 50% reduction in on-the-job accidents. Managed the maintenance and operation of fleet vehicles, ensuring 100% compliance with state regulations. City of Houston Houston, TX Garbage Truck Driver Jan 2015 - Mar 2018 Operated garbage trucks on designated routes, ensuring timely and efficient waste collection for over 500 households daily. Trained and mentored new drivers on operational procedures and safety protocols. Consistently received positive feedback from residents for punctuality and professionalism. Education Houston High School Houston, TX High School Diploma 2006 - 2010 Graduated with honors, focusing on practical skills and community service."
garbage-truck-driver,"Contact [email protected] +86 138 0012 3456 Skills • Route Optimization • Safety Compliance • Customer Service • Vehicle Maintenance • Team Leadership Li Wei Beijing, China | himalayas.app/@liwei Dedicated Senior Garbage Truck Driver with over 10 years of experience in waste collection and transportation. Proven track record of maintaining safety standards and optimizing routes to enhance efficiency and reduce fuel consumption in urban settings. Professional Experience Beijing Environmental Services Beijing, China Senior Garbage Truck Driver May 2018 - Present Managed daily waste collection routes servicing over 1,500 households Implemented route optimization strategies resulting in a 20% decrease in fuel costs Trained and mentored 10 junior drivers on safety protocols and operational procedures Shanghai Waste Management Co. Shanghai, China Garbage Truck Driver Mar 2014 - Apr 2018 Operated heavy-duty garbage trucks ensuring timely waste collection across various districts Maintained vehicle cleanliness and performed routine inspections to comply with safety regulations Collaborated with city officials to address community waste management concerns Education Beijing High School Beijing, China High School Diploma 2005 - 2008 Completed secondary education with a focus on vocational training in transportation and logistics."
garbage-truck-driver,"Contact [email protected] +1 (555) 987-6543 Skills • Commercial Driving • Safety Compliance • Route Navigation • Vehicle Maintenance • Customer Service Emily Johnson Dallas, TX | himalayas.app/@emilyjohnson Dedicated and safety-conscious Garbage Truck Driver with over 5 years of experience in waste collection and management. Proven track record in maintaining high standards of service delivery while ensuring compliance with safety regulations. Professional Experience Waste Management Inc. Dallas, TX Garbage Truck Driver Mar 2019 - Present Operated garbage trucks on designated routes, successfully collecting waste from over 300 households daily Maintained a 99% on-time collection rate while adhering to safety protocols Trained new drivers on route navigation and vehicle operation procedures City Sanitation Services Fort Worth, TX Waste Collector Jan 2017 - Feb 2019 Assisted in waste collection and recycling programs, improving community recycling rates by 20% Conducted daily vehicle inspections to ensure operational safety and compliance Engaged with community members to address waste management concerns and promote sanitation awareness Education Dallas High School Dallas, TX High School Diploma 2012 - 2016 Graduated with a focus on vocational training and safety practices."
gardener,"Contact [email protected] +65 9123 4567 Skills • Landscape Design • Sustainable Gardening • Team Leadership • Plant Care • Pest Management • Irrigation Systems Emily Tan Singapore, SG | himalayas.app/@emilytan Dedicated Head Gardener with over 10 years of experience in landscape design, plant care, and team leadership. Proven track record of transforming green spaces into thriving gardens through innovative horticultural practices and sustainable methods. Professional Experience Green Oasis Gardens Singapore, SG Head Gardener Mar 2019 - Present Managed a team of 10 gardeners to maintain and enhance over 50 residential and commercial gardens. Implemented sustainable gardening practices that reduced water usage by 30%. Designed and executed seasonal planting plans that increased floral diversity and bloom duration. Tropical Gardens Pte Ltd Singapore, SG Senior Gardener Jan 2015 - Feb 2019 Led the design and planting of tropical gardens for high-profile clients, achieving a 95% client satisfaction rate. Conducted workshops for new staff on plant care techniques and pest management. Developed a plant health monitoring system that decreased plant loss by 25%. Education Singapore Polytechnic Singapore, SG Diploma in Horticulture 2012 - 2014 Specialized in landscape management and sustainable gardening practices."
